{
  "id": "general-motors-2026-06-22",
  "company": "General Motors",
  "industry": "Other",
  "geography": "United States",
  "eventDate": "2026-06-22",
  "layoffsCount": 1300,
  "status": "verified",
  "aiRelevance": "automation_efficiency_cited",
  "sourceQuality": "reputable_reporting",
  "summary": "Ars Technica reported that General Motors installed about 50 collaborative robot arms at Factory Zero while 1,300 workers remained out of work following a temporary layoff tied to idled EV production.",
  "evidenceQuote": "Dozens of new robot arms have been installed at General Motors' flagship electric vehicle factory in Detroit, even as 1,300 workers remain out of work following what was supposed to be a temporary layoff.",
  "notes": "WardsAuto reported that GM spokesperson Kevin Kelly confirmed the approximately 1,300-worker temporary layoff, effective March 16 through April 13, citing Reuters. Ars Technica later reported that 1,300 workers remained out of work while GM installed approximately 50 FANUC robot arms at Factory Zero. The New York Post rounded the affected workforce as more than 1,000. This is separate from GM's May 2026 IT department layoffs and from a prior Factory Zero permanent layoff of about 1,200 workers in late 2025.",
  "sources": [
    {
      "name": "Ars Technica",
      "url": "https://arstechnica.com/ai/2026/06/gm-installs-robots-at-flagship-ev-factory-after-laying-off-1300-workers/",
      "type": "reputable_reporting",
      "publishedDate": "2026-06-22",
      "quote": "Dozens of new robot arms have been installed at General Motors' flagship electric vehicle factory in Detroit, even as 1,300 workers remain out of work following what was supposed to be a temporary layoff."
    },
    {
      "name": "New York Post",
      "url": "https://nypost.com/2026/06/21/us-news/gm-replaces-more-than-1000-workers-with-50-robots-at-flagship-detroit-plant/",
      "type": "reputable_reporting",
      "publishedDate": "2026-06-21",
      "quote": "General Motors has gutted its electric-vehicle ambitions and sidelined more than 1,000 jobs at its flagship Detroit assembly plant - while adding 50 robots, sparking outrage from labor unions."
    },
    {
      "name": "WardsAuto",
      "url": "https://www.wardsauto.com/news/GM-temporarily-lays-off-1300-workers-factory-zero-uaw-evs/816227/",
      "type": "reputable_reporting",
      "publishedDate": "2026-03-31",
      "quote": "General Motors has temporarily laid off around 1,300 workers at its Factory Zero electric vehicle plant in Michigan for a 30-day period as the automaker adjusts production to meet market demand for EVs."
    }
  ],
  "createdAt": "2026-06-25T08:58:00-07:00",
  "updatedAt": "2026-06-25T08:58:00-07:00"
}
