{
  "id": "walmart-2026-05-12",
  "company": "Walmart",
  "industry": "Other",
  "geography": "United States",
  "eventDate": "2026-05-12",
  "layoffsCount": 1000,
  "status": "verified",
  "aiRelevance": "ai_adjacent_restructuring",
  "sourceQuality": "reputable_reporting",
  "summary": "The Wall Street Journal reported Walmart would cut or relocate about 1,000 corporate workers as it combines more global-technology and product teams after a review by its AI acceleration and technology leaders.",
  "evidenceQuote": "Walmart said Tuesday it would cut or relocate about 1,000 corporate workers as it looks to combine more of its global-technology and product teams.",
  "notes": "The WSJ article says the review was led by Daniel Danker, Walmart's head of global AI acceleration, and Suresh Kumar, its head of global technology, and that they decided to streamline teams to operate more efficiently. This is included as AI-adjacent restructuring because the affected organization overlaps technology/product and AI acceleration leadership, but the available WSJ excerpt does not say AI automation directly replaced the workers. The reported 1,000 figure includes employees being cut or relocated, so layoffsCount should be read as affected corporate workers rather than confirmed terminations only.",
  "sources": [
    {
      "name": "The Wall Street Journal",
      "url": "https://www.wsj.com/business/retail/walmart-layoffs-relocates-technology-jobs-23bbf322",
      "type": "reputable_reporting",
      "publishedDate": "2026-05-12",
      "quote": "This past summer Walmart hired Daniel Danker, who was an Instacart executive, to fill a new role as head of global AI acceleration. Since then Danker and Walmart's head of global technology, Suresh Kumar, have reviewed their internal structures and decided to streamline some teams to operate more efficiently."
    }
  ],
  "createdAt": "2026-05-13T11:40:00-07:00",
  "updatedAt": "2026-05-13T11:40:00-07:00"
}
