{
  "id": "intuit-2026-05-20",
  "company": "Intuit",
  "industry": "Finance",
  "geography": "Global",
  "eventDate": "2026-05-20",
  "layoffsCount": 3000,
  "status": "verified",
  "aiRelevance": "explicit_ai_cited",
  "sourceQuality": "reputable_reporting",
  "summary": "Yahoo Finance / Reuters reported Intuit is laying off about 17% of its workforce, or about 3,000 employees worldwide, to streamline operations and sharpen focus on key bets including AI efforts.",
  "evidenceQuote": "Intuit is laying off about 17% of its workforce, or about 3,000 employees worldwide, to streamline operations and sharpen focus on its key bets including its AI efforts.",
  "notes": "Yahoo Finance's Reuters syndication says the internal memo frames the cuts around streamlining operations and sharpening focus on key bets, including AI efforts. The article also says the cuts are expected to help Intuit focus on efforts to infuse AI technology across its services. Because AI is explicitly cited in the layoff rationale, this is classified as explicit_ai_cited.",
  "sources": [
    {
      "name": "Yahoo Finance / Reuters",
      "url": "https://finance.yahoo.com/sectors/technology/articles/exclusive-intuit-cut-17-global-130424207.html",
      "type": "reputable_reporting",
      "publishedDate": "2026-05-20",
      "quote": "Intuit is laying off about 17% of its workforce, or about 3,000 employees worldwide, to streamline operations and sharpen focus on its key bets including its AI efforts."
    },
    {
      "name": "Intuit 2025 Form 10-K",
      "url": "https://investors.intuit.com/sec-filings/all-sec-filings/content/0000896878-25-000035/intu-20250731.htm",
      "type": "primary",
      "publishedDate": "2025-09-03",
      "quote": "As of July 31, 2025, we had approximately 18,200 employees in seven countries."
    },
    {
      "name": "Intuit",
      "url": "https://investors.intuit.com/news-events/press-releases/detail/1311/intuit-unlocks-new-phase-of-growth-for-mid-market-businesses-combining-data-and-ai-to-drive-faster-more-profitable-decisions",
      "type": "primary",
      "publishedDate": "2026-05-13",
      "quote": "AI-Native ERP, Intuit Enterprise Suite, is a command center for modern finance teams."
    }
  ],
  "createdAt": "2026-05-20T06:30:00-07:00",
  "updatedAt": "2026-05-20T06:45:00-07:00"
}
