{
  "id": "salesforce-2026-04-14",
  "company": "Salesforce",
  "industry": "Technology",
  "geography": "United States",
  "eventDate": "2026-04-14",
  "layoffsCount": 4000,
  "status": "verified",
  "aiRelevance": "explicit_ai_cited",
  "sourceQuality": "reputable_reporting",
  "summary": "Yahoo Finance reported that Salesforce management disclosed plans to lay off about 4,000 customer support workers as AI tools took over more service tasks.",
  "evidenceQuote": "Management also disclosed internal plans to lay off about 4,000 customer support workers as AI tools take over more service tasks.",
  "notes": "Added from the Yahoo Finance article Matt supplied. This is a direct AI-replacement style case tied to customer support automation.",
  "sources": [
    {
      "name": "Yahoo Finance",
      "url": "https://finance.yahoo.com/markets/stocks/articles/salesforce-data-breach-ai-layoffs-220744472.html",
      "type": "reputable_reporting",
      "publishedDate": "2026-04-14",
      "quote": "Management also disclosed internal plans to lay off about 4,000 customer support workers as AI tools take over more service tasks."
    }
  ],
  "createdAt": "2026-04-14T13:46:00-07:00",
  "updatedAt": "2026-04-14T13:46:00-07:00"
}
